<?xml version="1.0" encoding="UTF-8"?>
<xsd:schema xmlns:xsd="http://www.w3.org/2001/XMLSchema"
	targetNamespace="http://eng.grammar/entity/topic"
  	xmlns:eng="http://eng.grammar/entity/topic"
	xmlns:ent="http://eng.grammar/entity"
	elementFormDefault="qualified"
>
	<xsd:import namespace="http://eng.grammar/entity" schemaLocation="../entity/entity.xsd" />

	<xsd:element name="topics">
		<xsd:complexType>
			<xsd:sequence>
				<xsd:element name="topic" type="eng:Topic" minOccurs="0" maxOccurs="unbounded"/>
			</xsd:sequence>
		</xsd:complexType>
	</xsd:element>

	<xsd:complexType name="Topic">
		<xsd:complexContent>
			<xsd:extension base="ent:Entity">
				<xsd:all>
					<xsd:element name="levelId">
						<xsd:simpleType>
							<xsd:restriction base="xsd:integer">
								<xsd:minExclusive value="0"/>
							</xsd:restriction>
						</xsd:simpleType>
					</xsd:element>
					<xsd:element name="name">
						<xsd:simpleType>
							<xsd:restriction base="xsd:string">
								<xsd:minLength value="2"/>
								<xsd:maxLength value="128"/>
							</xsd:restriction>
						</xsd:simpleType>
					</xsd:element>
					<xsd:element name="content">
						<xsd:simpleType>
							<xsd:restriction base="xsd:string">
								<xsd:minLength value="2"/>
							</xsd:restriction>
						</xsd:simpleType>
					</xsd:element>
				</xsd:all>
			</xsd:extension>
		</xsd:complexContent>
	</xsd:complexType>
</xsd:schema>
